{
  "$schema": "../../../../../schemas/progress/progress-event.schema.json",
  "schemaVersion": 1,
  "eventId": "dd28fd9b-4b3b-4abd-8367-50eefad8dc17",
  "eventType": "verification_pending",
  "recordedAtUtc": "2026-09-07T02:03:04.927545+00:00",
  "occurredAtUtc": "2026-09-07T02:03:04.927545+00:00",
  "actor": {
    "type": "agent",
    "id": "codex-astra",
    "tool": "Codex"
  },
  "planVersion": "ELTS-build-plan-1.0+PC-001",
  "catalogSha256": "d17ba8b7575ffa0ebe2273fadb8c12b0adb5cdbcdd92828d8b69a1d381fc7bd0",
  "target": {
    "kind": "atomic_step",
    "id": "BOOT.S020"
  },
  "taskId": "P0.3",
  "fromStatus": "in_progress",
  "toStatus": "verification_pending",
  "taskRevision": 64,
  "previousTaskEventHash": "85e28544799e6c8fec5e8207151e0ca8efa3966b07b8ef6abf53ca8f549df77b",
  "causalEventHashes": [
    "0c7db9cf202d181c60aeba6796ffd0c79714ab72275c175007b2170276f2fa4d",
    "5b143014aae1f41e1fa289a203e0a65a69f8d18d5d41d230640ca5fc0f432c4b",
    "6725778212bf93d190ebc4fef0570d86603296a91ead1add455c9a0f5a4de61c",
    "85e28544799e6c8fec5e8207151e0ca8efa3966b07b8ef6abf53ca8f549df77b"
  ],
  "branch": "bootstrap/repository-governance",
  "claimedPaths": [
    "unity/Assets/ThirdParty/OpenVR/",
    "unity/Assets/Editor/ProjectBootstrap/",
    "tools/dependencies/",
    "docs/modules/openvr-dependency.md"
  ],
  "expectedChecks": [],
  "stopConditions": [],
  "evidence": [
    {
      "id": "BOOT.S020-BOOT.S020",
      "path": "project-management/progress/evidence/BOOT.S020.json",
      "sha256": "bb0ebc494fd11620b291800cd4a0e16586fa09e04592832b6f2f63886277ea41",
      "targetIds": [
        "BOOT.S020"
      ],
      "criteria": [
        "outcome",
        "verification"
      ],
      "class": "toolchain_runtime",
      "command": "python tools/dependencies/verify_openvr.py; python -m unittest tools.dependencies.test_openvr -v; Unity -batchmode -nographics -quit -executeMethod Elts.Editor.OpenVrImporter.Configure",
      "result": "pass",
      "sourceRevision": "4bec3598a8d9d3fb4b3821644b10ba3143d556b4",
      "recordedAtUtc": "2026-09-07T02:03:03.762002+00:00",
      "limitations": [
        "Vendoring/compilation only; no OpenVR initialization or native ABI calls performed",
        "SteamVR, device serials/reconnect/polling/trigger/calibration/physical safety remain unverified",
        "Synthetic source does not reference or initialize Valve.OpenVR",
        "Upstream convenience matrix conversions excluded from ELTS adapter use; Tracking owns validated conversion"
      ]
    }
  ],
  "blockers": [],
  "note": "Pinned unmodified OpenVR binding/native library, license/notice/provenance and Windows x64 importer verified.",
  "approval": null,
  "handoffTo": null
}
