{
  "$schema": "../../../../../schemas/progress/progress-event.schema.json",
  "schemaVersion": 1,
  "eventId": "519661e9-ad9c-4aa7-8ec9-ac15a5f51ef3",
  "eventType": "step_completed",
  "recordedAtUtc": "2026-09-08T05:54:54.542052+00:00",
  "occurredAtUtc": "2026-09-08T05:54:54.542052+00:00",
  "actor": {
    "type": "agent",
    "id": "codex-astra",
    "tool": "Codex"
  },
  "planVersion": "ELTS-build-plan-1.0+PC-001",
  "catalogSha256": "d17ba8b7575ffa0ebe2273fadb8c12b0adb5cdbcdd92828d8b69a1d381fc7bd0",
  "target": {
    "kind": "atomic_step",
    "id": "DEV-06.V001"
  },
  "taskId": "DEV-06",
  "fromStatus": "verification_pending",
  "toStatus": "done",
  "taskRevision": 6,
  "previousTaskEventHash": "c83a4ecd2eee467e02d2354dc9372e85346c032a47b4bf002f048f375e3afba5",
  "causalEventHashes": [
    "0c7db9cf202d181c60aeba6796ffd0c79714ab72275c175007b2170276f2fa4d",
    "1c16bb2a387b17e96b7e7d76d5ef2e784a1cfa55e38c57e71381c76f271c0262",
    "2107017562779c7b0e22e39d5395bceceb97cfc4b2041d49b4cbee4a04cfc300",
    "6725778212bf93d190ebc4fef0570d86603296a91ead1add455c9a0f5a4de61c",
    "6d86b96019b4e9092bf2ba43110c0b086f5fcc37fd3dbe526812be5b55e66b4b",
    "b456cff38d75cf98ff4a0017df409acc3f081e2f63c9346ba259914888548a5f",
    "c83a4ecd2eee467e02d2354dc9372e85346c032a47b4bf002f048f375e3afba5",
    "e1f4be38617939f12950718026cd16b1f556dd3f19549016ff809b60c20b034d",
    "ff89ba440bf29decf3a60303ff022dc84b2cdcb84244aa4a4dfd9c100d94740b"
  ],
  "branch": "work/dev-06",
  "claimedPaths": [
    "project-management/progress/evidence/DEV-06.json"
  ],
  "expectedChecks": [],
  "stopConditions": [],
  "evidence": [
    {
      "id": "DEV-06-acceptance",
      "path": "project-management/progress/evidence/DEV-06.json",
      "sha256": "96fa4a53f51ebc2e0674412c75d9f57bfb666e51a97a14f1e17a3d8f3cee5fd3",
      "targetIds": [
        "DEV-06.S001",
        "DEV-06.V001",
        "DEV-06"
      ],
      "criteria": [
        "outcome",
        "verification",
        "task-acceptance"
      ],
      "class": "synthetic_test",
      "command": "RenderingChecks; ReplayChecks; scripts/test.ps1 -Suite unity-play; scripts/build.ps1 -Output build/dev06-aspect; standalone -eltsViewScreenshot; python -m tools.build.verify build/dev06-aspect",
      "result": "pass",
      "sourceRevision": "ef8acebe344b01bba8c2ad534a5d91f6c327cc14",
      "recordedAtUtc": "2026-09-08T05:54:44.932238+00:00",
      "limitations": [
        "Synthetic geometry and display emulation only; no physical calibration or display assignment",
        "Controls exercised through shared runtime handlers; native mouse/keyboard interaction unverified",
        "Offscreen screenshot excludes IMGUI; no full-load timing or safety acceptance"
      ]
    }
  ],
  "blockers": [],
  "note": "Synthetic off-axis participant/operator rendering and strict recorded replay verified in Unity and the standalone player.",
  "approval": null,
  "handoffTo": null
}
