{
  "$schema": "../../../../../schemas/progress/progress-event.schema.json",
  "schemaVersion": 1,
  "eventId": "c0e46ad0-eba7-4c12-812d-2e81eccdb80f",
  "eventType": "task_started",
  "recordedAtUtc": "2026-09-07T02:08:26.566541+00:00",
  "occurredAtUtc": "2026-09-07T02:08:26.566541+00:00",
  "actor": {
    "type": "agent",
    "id": "codex-astra",
    "tool": "Codex"
  },
  "planVersion": "ELTS-build-plan-1.0+PC-001",
  "catalogSha256": "d17ba8b7575ffa0ebe2273fadb8c12b0adb5cdbcdd92828d8b69a1d381fc7bd0",
  "target": {
    "kind": "atomic_step",
    "id": "DEV-04.S001"
  },
  "taskId": "DEV-04",
  "fromStatus": "ready",
  "toStatus": "in_progress",
  "taskRevision": 1,
  "previousTaskEventHash": null,
  "causalEventHashes": [
    "0179fadda6bd748fc32b828bdadc02da4172a7c5c0738df4d906fbdb2ebb4293",
    "0c7db9cf202d181c60aeba6796ffd0c79714ab72275c175007b2170276f2fa4d",
    "6725778212bf93d190ebc4fef0570d86603296a91ead1add455c9a0f5a4de61c",
    "b456cff38d75cf98ff4a0017df409acc3f081e2f63c9346ba259914888548a5f"
  ],
  "branch": "work/dev04-logging",
  "claimedPaths": [
    "unity/Assets/ELTS/Logging/",
    "schemas/logs/",
    "tools/runtime-tests/LoggingChecks.cs",
    "tools/runtime-tests/LoggingChecks.csproj",
    "tools/logging/",
    "docs/modules/logging.md"
  ],
  "expectedChecks": [
    "Versioned raw samples/events/target/session products and roundtrip schemas",
    "Bounded queues, explicit drops, event overflow/failure, no-overwrite and orderly close",
    "Measured synthetic soak with source/config provenance"
  ],
  "stopConditions": [
    "Research log invariant violation",
    "Unresolved schema/clock contract",
    "Data loss without explicit accounting"
  ],
  "evidence": [],
  "blockers": [],
  "note": "Begin eligible logging and target snapshot foundations after DEV-03 verification; physical full-load evidence remains separate.",
  "approval": null,
  "handoffTo": null
}
