{
  "$schema": "../../../../../schemas/progress/progress-event.schema.json",
  "schemaVersion": 1,
  "eventId": "1c48508c-10d6-48ba-9636-0961348bfe6f",
  "eventType": "blocked",
  "recordedAtUtc": "2026-09-07T01:32:48.331341+00:00",
  "occurredAtUtc": "2026-09-07T01:32:48.331341+00:00",
  "actor": {
    "type": "agent",
    "id": "codex-astra",
    "tool": "Codex"
  },
  "planVersion": "ELTS-build-plan-1.0+PC-001",
  "catalogSha256": "d17ba8b7575ffa0ebe2273fadb8c12b0adb5cdbcdd92828d8b69a1d381fc7bd0",
  "target": {
    "kind": "atomic_step",
    "id": "DEV-02.S001"
  },
  "taskId": "DEV-02",
  "fromStatus": "in_progress",
  "toStatus": "blocked",
  "taskRevision": 2,
  "previousTaskEventHash": "71a693e71c4feea4a361b5982ae03c05f1d1d5181722a449a106dfdd0abaad53",
  "causalEventHashes": [
    "6725778212bf93d190ebc4fef0570d86603296a91ead1add455c9a0f5a4de61c",
    "71a693e71c4feea4a361b5982ae03c05f1d1d5181722a449a106dfdd0abaad53",
    "78f9c75ee6067d1c0aba081dccc1d9f15c3c5e85e91b29687f028232d266388e"
  ],
  "branch": "work/dev02-clock-tracking",
  "claimedPaths": [
    "unity/Assets/ELTS/Tracking/",
    "unity/Assets/ELTS/Time/",
    "tools/runtime-tests/TrackingChecks.cs",
    "tools/runtime-tests/TrackingChecks.csproj",
    "docs/modules/tracking.md"
  ],
  "expectedChecks": [],
  "stopConditions": [],
  "evidence": [],
  "blockers": [
    {
      "id": "DEV02-clock-path-claim",
      "reason": "Initial claim used Time directory while canonical skeleton uses Clock",
      "requiredAction": "Reconcile claim with existing Clock module before editing",
      "responsibleRole": "coordinator"
    }
  ],
  "note": "Correct a coordinator claim-path mismatch without rewriting the prior event.",
  "approval": null,
  "handoffTo": null
}
