{
  "$schema": "../../../../../schemas/progress/progress-event.schema.json",
  "schemaVersion": 1,
  "eventId": "b6bf3589-264b-4da8-93ea-4149a4b8ccb3",
  "eventType": "task_started",
  "recordedAtUtc": "2026-09-07T00:56:05.138025+00:00",
  "occurredAtUtc": "2026-09-07T00:56:05.138025+00:00",
  "actor": {
    "type": "agent",
    "id": "codex-astra",
    "tool": "Codex"
  },
  "planVersion": "ELTS-build-plan-1.0+PC-001",
  "catalogSha256": "d17ba8b7575ffa0ebe2273fadb8c12b0adb5cdbcdd92828d8b69a1d381fc7bd0",
  "target": {
    "kind": "atomic_step",
    "id": "BOOT.S014"
  },
  "taskId": "P0.3",
  "fromStatus": "ready",
  "toStatus": "in_progress",
  "taskRevision": 40,
  "previousTaskEventHash": "3e57f23c3ca9d2132c0e8425f12f2772e250c1d4322e0f56c4d1d4803b89b897",
  "causalEventHashes": [
    "3e57f23c3ca9d2132c0e8425f12f2772e250c1d4322e0f56c4d1d4803b89b897",
    "9dd0e60e40e368e777b7628ead17ec932106650a77ce363f92152e7fe7e6d868"
  ],
  "branch": "bootstrap/repository-governance",
  "claimedPaths": [
    "AGENTS.md",
    "CLAUDE.md",
    ".github/copilot-instructions.md",
    "docs/ai/agent-protocol.md"
  ],
  "expectedChecks": [
    "Verify the assigned approved-plan outcome with source-bound evidence"
  ],
  "stopConditions": [
    "Contract or authority conflict",
    "Required input unavailable",
    "Verification fails"
  ],
  "evidence": [],
  "blockers": [],
  "note": "Begin exact approved atomic step; preserve pending physical gates.",
  "approval": null,
  "handoffTo": null
}
