{
  "$schema": "../../../../../schemas/progress/progress-event.schema.json",
  "schemaVersion": 1,
  "eventId": "10827d44-0107-49bc-b81d-238c304fc757",
  "eventType": "step_completed",
  "recordedAtUtc": "2026-09-07T02:32:35.538141+00:00",
  "occurredAtUtc": "2026-09-07T02:32:35.538141+00:00",
  "actor": {
    "type": "agent",
    "id": "codex-astra",
    "tool": "Codex"
  },
  "planVersion": "ELTS-build-plan-1.0+PC-001",
  "catalogSha256": "d17ba8b7575ffa0ebe2273fadb8c12b0adb5cdbcdd92828d8b69a1d381fc7bd0",
  "target": {
    "kind": "atomic_step",
    "id": "BOOT.S025"
  },
  "taskId": "P0.3",
  "fromStatus": "verification_pending",
  "toStatus": "done",
  "taskRevision": 80,
  "previousTaskEventHash": "5c592c3db80a0fceeb9d7c9495f384f9da10b78247fe49ba0ff0186bc204abec",
  "causalEventHashes": [
    "0c7db9cf202d181c60aeba6796ffd0c79714ab72275c175007b2170276f2fa4d",
    "5c592c3db80a0fceeb9d7c9495f384f9da10b78247fe49ba0ff0186bc204abec",
    "6725778212bf93d190ebc4fef0570d86603296a91ead1add455c9a0f5a4de61c",
    "a13b48c990029ad9018e570d32d312d78f2390f4b3b4db7df8bc4f1488e471d8",
    "b456cff38d75cf98ff4a0017df409acc3f081e2f63c9346ba259914888548a5f"
  ],
  "branch": "bootstrap/repository-governance",
  "claimedPaths": [
    ".github/CODEOWNERS",
    ".github/PULL_REQUEST_TEMPLATE.md",
    "docs/governance/repository-rules.md"
  ],
  "expectedChecks": [],
  "stopConditions": [],
  "evidence": [
    {
      "id": "BOOT.S025-BOOT.S025",
      "path": "project-management/progress/evidence/BOOT.S025.json",
      "sha256": "b3adb81478c97c9c89af40f53302eaf01935709af6999ef0d636dad1bb4c4402",
      "targetIds": [
        "BOOT.S025"
      ],
      "criteria": [
        "outcome",
        "verification"
      ],
      "class": "document",
      "command": "git remote -v; git ls-remote origin; python tools/ci/check.py; inspect CODEOWNERS, PR template and rules documentation against spec14.4 and PC-001",
      "result": "pass",
      "sourceRevision": "cefe5f8d4a91d0041008028eedef2b6f5cd9e245",
      "recordedAtUtc": "2026-09-07T02:32:32.650156+00:00",
      "limitations": [
        "No remote settings were configured or verified; remote protection and status names remain pending controls",
        "No remote push, merge, issue/Trello update or Butler verification",
        "Named research/safety reviewers and commit-signing decision remain pending",
        "Documented route passes this bootstrap outcome only; no physical/study/release gate acceptance"
      ]
    }
  ],
  "blockers": [],
  "note": "Required repository review/protection, squash merge and canonical mirror reconciliation controls are documented using the accepted PC-001 route.",
  "approval": null,
  "handoffTo": null
}
