{
  "$schema": "../../../../../schemas/progress/progress-event.schema.json",
  "schemaVersion": 1,
  "eventId": "c075fa7e-2341-4134-ab24-8aa9fa50a4b8",
  "eventType": "task_started",
  "recordedAtUtc": "2026-09-07T00:56:55.778624+00:00",
  "occurredAtUtc": "2026-09-07T00:56:55.778624+00:00",
  "actor": {
    "type": "agent",
    "id": "codex-astra",
    "tool": "Codex"
  },
  "planVersion": "ELTS-build-plan-1.0+PC-001",
  "catalogSha256": "d17ba8b7575ffa0ebe2273fadb8c12b0adb5cdbcdd92828d8b69a1d381fc7bd0",
  "target": {
    "kind": "atomic_step",
    "id": "BOOT.S015"
  },
  "taskId": "P0.3",
  "fromStatus": "ready",
  "toStatus": "in_progress",
  "taskRevision": 43,
  "previousTaskEventHash": "2e8adec184e15fdc349656b5a55777b4acd92b44e07d11e47fdd691e91f296cb",
  "causalEventHashes": [
    "2e8adec184e15fdc349656b5a55777b4acd92b44e07d11e47fdd691e91f296cb",
    "9dd0e60e40e368e777b7628ead17ec932106650a77ce363f92152e7fe7e6d868"
  ],
  "branch": "bootstrap/repository-governance",
  "claimedPaths": [
    "docs/templates/",
    "docs/ai/handoff-template.md"
  ],
  "expectedChecks": [
    "Verify the assigned approved-plan outcome with source-bound evidence"
  ],
  "stopConditions": [
    "Contract or authority conflict",
    "Required input unavailable",
    "Verification fails"
  ],
  "evidence": [],
  "blockers": [],
  "note": "Begin exact approved atomic step; preserve pending physical gates.",
  "approval": null,
  "handoffTo": null
}
