{
  "$schema": "../../../../../schemas/progress/progress-event.schema.json",
  "schemaVersion": 1,
  "eventId": "53cda79f-7dde-4e93-b464-fdab03b6f28e",
  "eventType": "task_started",
  "recordedAtUtc": "2026-09-07T01:00:30.365375+00:00",
  "occurredAtUtc": "2026-09-07T01:00:30.365375+00:00",
  "actor": {
    "type": "agent",
    "id": "codex-astra",
    "tool": "Codex"
  },
  "planVersion": "ELTS-build-plan-1.0+PC-001",
  "catalogSha256": "d17ba8b7575ffa0ebe2273fadb8c12b0adb5cdbcdd92828d8b69a1d381fc7bd0",
  "target": {
    "kind": "atomic_step",
    "id": "BOOT.S017"
  },
  "taskId": "P0.3",
  "fromStatus": "ready",
  "toStatus": "in_progress",
  "taskRevision": 49,
  "previousTaskEventHash": "36ab11e23cfc42d75c1b06f569ba940f713cfa9fa4d15f56b661a230762931e8",
  "causalEventHashes": [
    "36ab11e23cfc42d75c1b06f569ba940f713cfa9fa4d15f56b661a230762931e8",
    "9dd0e60e40e368e777b7628ead17ec932106650a77ce363f92152e7fe7e6d868"
  ],
  "branch": "bootstrap/repository-governance",
  "claimedPaths": [
    "config/defaults/",
    "config/development/",
    "config/rig/",
    "config/study/",
    "config/local.example.json",
    "config/staging.json",
    "schemas/config/",
    "tools/config/",
    "docs/modules/config-staging.md"
  ],
  "expectedChecks": [
    "Verify the assigned approved-plan outcome with source-bound evidence"
  ],
  "stopConditions": [
    "Contract or authority conflict",
    "Required input unavailable",
    "Verification fails"
  ],
  "evidence": [],
  "blockers": [],
  "note": "Begin exact approved atomic step; preserve pending physical gates.",
  "approval": null,
  "handoffTo": null
}
