{
  "$schema": "../../../../../schemas/progress/progress-event.schema.json",
  "schemaVersion": 1,
  "eventId": "9c3dd7d0-9de0-43ab-974a-5fefa5276710",
  "eventType": "task_started",
  "recordedAtUtc": "2026-09-07T00:50:26.429722+00:00",
  "occurredAtUtc": "2026-09-07T00:44:27.390933+00:00",
  "actor": {
    "type": "agent",
    "id": "codex-astra",
    "tool": "Codex"
  },
  "planVersion": "ELTS-build-plan-1.0+PC-001",
  "catalogSha256": "d17ba8b7575ffa0ebe2273fadb8c12b0adb5cdbcdd92828d8b69a1d381fc7bd0",
  "target": {
    "kind": "atomic_step",
    "id": "BOOT.S007"
  },
  "taskId": "P0.3",
  "fromStatus": "ready",
  "toStatus": "in_progress",
  "taskRevision": 19,
  "previousTaskEventHash": "7c981130d0c4c94059c62b0025c7137a6f508f48842c6253ae5daaa92fd560c1",
  "causalEventHashes": [
    "7c981130d0c4c94059c62b0025c7137a6f508f48842c6253ae5daaa92fd560c1"
  ],
  "branch": "bootstrap/repository-governance",
  "claimedPaths": [
    "tools/progress/",
    "schemas/progress/",
    "docs/modules/progress.md"
  ],
  "expectedChecks": [
    "11 planner tests passed",
    "32 progress tests passed",
    "Plan, schema and catalog drift checks passed",
    "Immutable verification report binds source snapshot 31931d8"
  ],
  "stopConditions": [
    "Evidence or ownership mismatch",
    "Authority conflict"
  ],
  "evidence": [],
  "blockers": [],
  "note": "PC-001 journal 091b28eef32593f85895a9b31c1244908b3aafd828ac0896741ce5ae6050d7d9: Implemented validated atomic create-new event writer, exclusive writer lock, stale-state rejection and recoverable state publication.",
  "approval": null,
  "handoffTo": null
}
