{
  "$schema": "../../../../../schemas/progress/progress-event.schema.json",
  "schemaVersion": 1,
  "eventId": "8d1a1ed6-0e7f-4f15-83bd-6680be9f244f",
  "eventType": "task_completed",
  "recordedAtUtc": "2026-09-07T02:52:35.888202+00:00",
  "occurredAtUtc": "2026-09-07T02:52:35.888202+00:00",
  "actor": {
    "type": "agent",
    "id": "codex-astra",
    "tool": "Codex"
  },
  "planVersion": "ELTS-build-plan-1.0+PC-001",
  "catalogSha256": "d17ba8b7575ffa0ebe2273fadb8c12b0adb5cdbcdd92828d8b69a1d381fc7bd0",
  "target": {
    "kind": "task",
    "id": "P0.3"
  },
  "taskId": "P0.3",
  "fromStatus": "verification_pending",
  "toStatus": "done",
  "taskRevision": 84,
  "previousTaskEventHash": "736b32cb1cc8db6372558f90de2e9a6f627d28530385fb2cef82015156f5f56c",
  "causalEventHashes": [
    "0c7db9cf202d181c60aeba6796ffd0c79714ab72275c175007b2170276f2fa4d",
    "6725778212bf93d190ebc4fef0570d86603296a91ead1add455c9a0f5a4de61c",
    "736b32cb1cc8db6372558f90de2e9a6f627d28530385fb2cef82015156f5f56c",
    "a13b48c990029ad9018e570d32d312d78f2390f4b3b4db7df8bc4f1488e471d8",
    "b456cff38d75cf98ff4a0017df409acc3f081e2f63c9346ba259914888548a5f"
  ],
  "branch": "bootstrap/repository-governance",
  "claimedPaths": [],
  "expectedChecks": [],
  "stopConditions": [],
  "evidence": [
    {
      "id": "P0.3-bootstrap-closure",
      "path": "project-management/progress/evidence/P0.3.json",
      "sha256": "fbc11c8895aab93b8c309d9fda0c54f1ec5d08ec82d254db8d5b8cb6f8363870",
      "targetIds": [
        "P0.3"
      ],
      "criteria": [
        "task-acceptance"
      ],
      "class": "document",
      "command": "Validate all26 active bootstrap statuses and immutable evidence hashes; compare retained P0.3 completion requirements with BOOT.S019 through BOOT.S026 results",
      "result": "pass",
      "sourceRevision": "0b406a9c5401a42195ea99250548cfe5969b3b6b",
      "recordedAtUtc": "2026-09-07T02:52:34.898342+00:00",
      "limitations": [
        "No physical, safety, study or release gate acceptance",
        "No remote push/merge/settings/CI verification",
        "DEV04 logging soak remains in progress; development does not automatically complete baseline support tasks"
      ]
    }
  ],
  "blockers": [],
  "note": "Repository/project bootstrap completed: all26 active steps and retained clean-clone Unity/test/Windows-build requirements verified. G0 and physical/study controls remain pending.",
  "approval": null,
  "handoffTo": null
}
