{
  "$schema": "../../../../../schemas/progress/progress-event.schema.json",
  "schemaVersion": 1,
  "eventId": "dc06846c-2a47-4535-b39a-81b6b0f19fc8",
  "eventType": "task_started",
  "recordedAtUtc": "2026-09-08T05:39:41.751510+00:00",
  "occurredAtUtc": "2026-09-08T05:39:41.751510+00:00",
  "actor": {
    "type": "agent",
    "id": "codex-astra",
    "tool": "Codex"
  },
  "planVersion": "ELTS-build-plan-1.0+PC-001",
  "catalogSha256": "d17ba8b7575ffa0ebe2273fadb8c12b0adb5cdbcdd92828d8b69a1d381fc7bd0",
  "target": {
    "kind": "atomic_step",
    "id": "DEV-10.S001"
  },
  "taskId": "DEV-10",
  "fromStatus": "ready",
  "toStatus": "in_progress",
  "taskRevision": 1,
  "previousTaskEventHash": null,
  "causalEventHashes": [
    "0c7db9cf202d181c60aeba6796ffd0c79714ab72275c175007b2170276f2fa4d",
    "1605a514d95d4cf951b1f6986c6f892d1af2c15c6895f5fb6bbfbb50c49265b1",
    "1c16bb2a387b17e96b7e7d76d5ef2e784a1cfa55e38c57e71381c76f271c0262",
    "2107017562779c7b0e22e39d5395bceceb97cfc4b2041d49b4cbee4a04cfc300",
    "6725778212bf93d190ebc4fef0570d86603296a91ead1add455c9a0f5a4de61c",
    "6d86b96019b4e9092bf2ba43110c0b086f5fcc37fd3dbe526812be5b55e66b4b",
    "b456cff38d75cf98ff4a0017df409acc3f081e2f63c9346ba259914888548a5f",
    "ff89ba440bf29decf3a60303ff022dc84b2cdcb84244aa4a4dfd9c100d94740b"
  ],
  "branch": "work/dev-10",
  "claimedPaths": [
    "unity/Assets/ELTS/Elts",
    "jetson",
    "schemas/protocol",
    "tools/runtime-tests/EltsLinkChecks.cs",
    "tools/runtime-tests/EltsLinkChecks.csproj",
    "docs/modules/elts-link.md"
  ],
  "expectedChecks": [
    "Explicit synthetic codec fixtures and mock/null/controller state checks",
    "Malformed/version/sequence/timeout/reconnect and command-only boundaries"
  ],
  "stopConditions": [
    "Actual wire compatibility details unavailable for physical adapters",
    "Physical transport or apparatus deployment requested",
    "Shared contract conflict"
  ],
  "evidence": [],
  "blockers": [],
  "note": "Implement normalized development-only lifecycle protocol from normative section11 message content; original controller wire compatibility remains explicitly deferred.",
  "approval": null,
  "handoffTo": null
}
