{
  "$schema": "../../../../../schemas/progress/progress-event.schema.json",
  "schemaVersion": 1,
  "eventId": "30b847a4-7d62-43ac-a3e2-d44290a84b7b",
  "eventType": "step_completed",
  "recordedAtUtc": "2026-09-08T06:01:27.707981+00:00",
  "occurredAtUtc": "2026-09-08T06:01:27.707981+00:00",
  "actor": {
    "type": "agent",
    "id": "codex-astra",
    "tool": "Codex"
  },
  "planVersion": "ELTS-build-plan-1.0+PC-001",
  "catalogSha256": "d17ba8b7575ffa0ebe2273fadb8c12b0adb5cdbcdd92828d8b69a1d381fc7bd0",
  "target": {
    "kind": "atomic_step",
    "id": "DEV-10.V001"
  },
  "taskId": "DEV-10",
  "fromStatus": "verification_pending",
  "toStatus": "done",
  "taskRevision": 6,
  "previousTaskEventHash": "f93a40b233bcc876eda3a86ddaddd5a9e6f9441702f447ca21e49a0c87d9bf7f",
  "causalEventHashes": [
    "0c7db9cf202d181c60aeba6796ffd0c79714ab72275c175007b2170276f2fa4d",
    "2107017562779c7b0e22e39d5395bceceb97cfc4b2041d49b4cbee4a04cfc300",
    "40f50c895dea123b4d210c1cff83c218d858500206ff02861a9060cb1647095e",
    "6725778212bf93d190ebc4fef0570d86603296a91ead1add455c9a0f5a4de61c",
    "6d86b96019b4e9092bf2ba43110c0b086f5fcc37fd3dbe526812be5b55e66b4b",
    "b456cff38d75cf98ff4a0017df409acc3f081e2f63c9346ba259914888548a5f",
    "d157add7ed962d52f12b203d407aa000bfe9dbc8602bfe4acf2d8632d3b8907d",
    "d8cd53b351badcbe2cdd06febf061bb74cb409130f0932205cc2d473009fccee",
    "f93a40b233bcc876eda3a86ddaddd5a9e6f9441702f447ca21e49a0c87d9bf7f",
    "ff89ba440bf29decf3a60303ff022dc84b2cdcb84244aa4a4dfd9c100d94740b"
  ],
  "branch": "work/dev-10",
  "claimedPaths": [
    "project-management/progress/evidence/DEV-10.json"
  ],
  "expectedChecks": [],
  "stopConditions": [],
  "evidence": [
    {
      "id": "DEV-10-acceptance",
      "path": "project-management/progress/evidence/DEV-10.json",
      "sha256": "bdc4233775794482448f5200b3f521d868c93b73d233e1512d80310ccc9afa9e",
      "targetIds": [
        "DEV-10.S001",
        "DEV-10.V001",
        "DEV-10"
      ],
      "criteria": [
        "outcome",
        "verification",
        "task-acceptance"
      ],
      "class": "synthetic_test",
      "command": "dotnet run --project tools/runtime-tests/EltsLinkChecks.csproj -p:NewtonsoftPath=<verified pinned Unity Newtonsoft.dll>; scripts/test.ps1 -Suite unity-play -Report diagnostics/dev10-integrated-play.json",
      "result": "pass",
      "sourceRevision": "26695b6055371eec6ee36bc7019ac7d557745e5f",
      "recordedAtUtc": "2026-09-08T06:01:17.578419+00:00",
      "limitations": [
        "development-synthetic-v1 field spellings and timeout values are explicit fixtures,not actualcontroller compatibility",
        "No network,serial,hardwaredeployment or physicalsafety validation",
        "Existingcontrollercode,D03,D10,D13 and unavailablebenchequipment remain required for physical integration"
      ]
    }
  ],
  "blockers": [],
  "note": "Strict development-only ELTS protocol codec and simulated/null command links verified; no physical transport or apparatus access.",
  "approval": null,
  "handoffTo": null
}
