{
  "$schema": "../../../../../schemas/progress/progress-event.schema.json",
  "schemaVersion": 1,
  "eventId": "4a39e9ea-110f-4592-801b-9f60ac40cb53",
  "eventType": "step_completed",
  "recordedAtUtc": "2026-09-07T03:13:42.220550+00:00",
  "occurredAtUtc": "2026-09-07T03:13:42.220550+00:00",
  "actor": {
    "type": "agent",
    "id": "codex-astra",
    "tool": "Codex"
  },
  "planVersion": "ELTS-build-plan-1.0+PC-001",
  "catalogSha256": "d17ba8b7575ffa0ebe2273fadb8c12b0adb5cdbcdd92828d8b69a1d381fc7bd0",
  "target": {
    "kind": "atomic_step",
    "id": "DEV-04.S001"
  },
  "taskId": "DEV-04",
  "fromStatus": "verification_pending",
  "toStatus": "done",
  "taskRevision": 7,
  "previousTaskEventHash": "21186e2250ba571d686f99e85015a7fba9ce253f7ced79737cf0e7bbb03d3b05",
  "causalEventHashes": [
    "0c7db9cf202d181c60aeba6796ffd0c79714ab72275c175007b2170276f2fa4d",
    "21186e2250ba571d686f99e85015a7fba9ce253f7ced79737cf0e7bbb03d3b05",
    "6725778212bf93d190ebc4fef0570d86603296a91ead1add455c9a0f5a4de61c",
    "b456cff38d75cf98ff4a0017df409acc3f081e2f63c9346ba259914888548a5f",
    "ff89ba440bf29decf3a60303ff022dc84b2cdcb84244aa4a4dfd9c100d94740b"
  ],
  "branch": "work/dev04-logging",
  "claimedPaths": [
    "unity/Assets/ELTS/Logging",
    "tools/runtime-tests/LoggingPublicationChecks.cs",
    "tools/runtime-tests/LoggingPublicationChecks.csproj",
    "docs/modules/logging.md"
  ],
  "expectedChecks": [],
  "stopConditions": [],
  "evidence": [
    {
      "id": "DEV-04-publication",
      "path": "project-management/progress/evidence/DEV-04-publication.json",
      "sha256": "d2654a0f47edb2c086fec1e8095dea776342e8a343b9a18da3c15a3b53dceb5c",
      "targetIds": [
        "DEV-04.S001"
      ],
      "criteria": [
        "outcome",
        "verification"
      ],
      "class": "synthetic_test",
      "command": "Integrated dotnet LoggingChecks, LoggingThroughputChecks, LoggingPublicationChecks; 2-second recording and offline verify_run; pending-only rejection; scripts/test.ps1 baseline and unity-edit",
      "result": "pass",
      "sourceRevision": "e88c515e3138c46a91a0573dd7658394e55ce7d2",
      "recordedAtUtc": "2026-09-07T03:13:37.677156+00:00",
      "limitations": [
        "Synthetic development acceptance only; baseline parents and physical gates remain pending.",
        "The 1800-second recording predates the terminal-publication fix; unchanged recording hot path is covered by that source-bound evidence and terminal behavior by new integrated checks.",
        "Configured 250 Hz, measured 244.37038269 Hz; timing target not met. Zero queue drops does not mean all nominal acquisition opportunities occurred.",
        "No full Unity/display-load, Study-PC disk, real-device or physical safety acceptance. OS final-move stalls can extend Close wait."
      ]
    }
  ],
  "blockers": [],
  "note": "Durably flushed pending summary is published only after terminal arbitration; failures and prepublication timeout cannot expose a completed run.",
  "approval": null,
  "handoffTo": null
}
