{
  "$schema": "../../../../../schemas/progress/progress-event.schema.json",
  "schemaVersion": 1,
  "eventId": "0a51393e-558a-4a64-994d-6c861c24dee3",
  "eventType": "verification_pending",
  "recordedAtUtc": "2026-09-08T06:47:37.515180+00:00",
  "occurredAtUtc": "2026-09-08T06:47:37.515180+00:00",
  "actor": {
    "type": "agent",
    "id": "codex-astra",
    "tool": "Codex"
  },
  "planVersion": "ELTS-build-plan-1.0+PC-001",
  "catalogSha256": "d17ba8b7575ffa0ebe2273fadb8c12b0adb5cdbcdd92828d8b69a1d381fc7bd0",
  "target": {
    "kind": "atomic_step",
    "id": "DEV-08.S001"
  },
  "taskId": "DEV-08",
  "fromStatus": "in_progress",
  "toStatus": "verification_pending",
  "taskRevision": 2,
  "previousTaskEventHash": "d8cd53b351badcbe2cdd06febf061bb74cb409130f0932205cc2d473009fccee",
  "causalEventHashes": [
    "0b0f12c54f933d68b7ba0e6e230cf33d630d4281214c6d2b2eb012e37261aaf9",
    "0c7db9cf202d181c60aeba6796ffd0c79714ab72275c175007b2170276f2fa4d",
    "2107017562779c7b0e22e39d5395bceceb97cfc4b2041d49b4cbee4a04cfc300",
    "40f50c895dea123b4d210c1cff83c218d858500206ff02861a9060cb1647095e",
    "6725778212bf93d190ebc4fef0570d86603296a91ead1add455c9a0f5a4de61c",
    "6d86b96019b4e9092bf2ba43110c0b086f5fcc37fd3dbe526812be5b55e66b4b",
    "b456cff38d75cf98ff4a0017df409acc3f081e2f63c9346ba259914888548a5f",
    "d157add7ed962d52f12b203d407aa000bfe9dbc8602bfe4acf2d8632d3b8907d",
    "d8cd53b351badcbe2cdd06febf061bb74cb409130f0932205cc2d473009fccee",
    "ff89ba440bf29decf3a60303ff022dc84b2cdcb84244aa4a4dfd9c100d94740b"
  ],
  "branch": "work/dev08",
  "claimedPaths": [
    "unity/Assets/ELTS/Session",
    "unity/Assets/ELTS/Operator",
    "tools/runtime-tests/SessionChecks.cs",
    "tools/runtime-tests/SessionChecks.csproj",
    "docs/modules/session.md"
  ],
  "expectedChecks": [],
  "stopConditions": [],
  "evidence": [
    {
      "id": "DEV-08-acceptance",
      "path": "project-management/progress/evidence/DEV-08.json",
      "sha256": "d5ea315774fe955ff6de85fbff9cf767ed18ec1c0f23ab176010b6d57fcec90c",
      "targetIds": [
        "DEV-08.S001",
        "DEV-08.V001",
        "DEV-08"
      ],
      "criteria": [
        "outcome",
        "verification",
        "task-acceptance"
      ],
      "class": "synthetic_test",
      "command": "SessionChecks; SessionRecordingAdapterChecks; SessionAcquisitionChecks Release; SessionInteropFixture --output test-results/dev08-session-final; analysis ingest and strict verification; scripts/test.ps1 -Suite unity-play; scripts/build.ps1 -Output build/dev08-layout; standalone -eltsSessionScreenshot; build manifest verification",
      "result": "pass",
      "sourceRevision": "50e796a69efdeabe935ccb9573b97b53d9cad0bd",
      "recordedAtUtc": "2026-09-08T06:47:36.193039+00:00",
      "limitations": [
        "Synthetic fixtures and unmeasured geometry only; manual-clock four-block fixture is not a20-minute wall-clock test",
        "UI callbacks exercised through Toolkit navigation events; native mouse/keyboard and physical display assignment unverified",
        "Real tracking, calibration, apparatus connection, physical timing and gates remain pending",
        "DEV08 link is an explicit lifecycle fixture pendingDEV11; D04 motion andD12 sync remain provisional",
        "Short-tail acquisition spin uses CPU to reduce timer oversleep; observed diagnostics do not pass full-load250Hz or physical timing criteria"
      ]
    }
  ],
  "blockers": [],
  "note": "Synthetic session state machine, operator control path, preserved abort/rerun recordings and versioned target expiry verified.",
  "approval": null,
  "handoffTo": null
}
