{
  "$schema": "../../../../../schemas/progress/progress-event.schema.json",
  "schemaVersion": 1,
  "eventId": "d1fb8951-0fc9-42ec-8b5f-89b5a476ab7d",
  "eventType": "task_started",
  "recordedAtUtc": "2026-09-07T02:32:38.521711+00:00",
  "occurredAtUtc": "2026-09-07T02:32:38.521711+00:00",
  "actor": {
    "type": "agent",
    "id": "codex-astra",
    "tool": "Codex"
  },
  "planVersion": "ELTS-build-plan-1.0+PC-001",
  "catalogSha256": "d17ba8b7575ffa0ebe2273fadb8c12b0adb5cdbcdd92828d8b69a1d381fc7bd0",
  "target": {
    "kind": "atomic_step",
    "id": "BOOT.S026"
  },
  "taskId": "P0.3",
  "fromStatus": "ready",
  "toStatus": "in_progress",
  "taskRevision": 81,
  "previousTaskEventHash": "b3c2127156f38d954642f4503884677705ae0aa07459761ab4a110c02ee68339",
  "causalEventHashes": [
    "0c7db9cf202d181c60aeba6796ffd0c79714ab72275c175007b2170276f2fa4d",
    "6725778212bf93d190ebc4fef0570d86603296a91ead1add455c9a0f5a4de61c",
    "a13b48c990029ad9018e570d32d312d78f2390f4b3b4db7df8bc4f1488e471d8",
    "b3c2127156f38d954642f4503884677705ae0aa07459761ab4a110c02ee68339",
    "b456cff38d75cf98ff4a0017df409acc3f081e2f63c9346ba259914888548a5f"
  ],
  "branch": "bootstrap/repository-governance",
  "claimedPaths": [
    "docs/ai/bootstrap-handoff.md",
    "scripts/first-run",
    "tools/bootstrap"
  ],
  "expectedChecks": [
    "Verify the assigned approved-plan outcome with source-bound evidence"
  ],
  "stopConditions": [
    "Contract or authority conflict",
    "Required input unavailable",
    "Verification fails"
  ],
  "evidence": [],
  "blockers": [],
  "note": "Begin exact approved atomic step; preserve pending physical gates.",
  "approval": null,
  "handoffTo": null
}
